{
  "objectType": "assessmentContext.v1",
  "objectId": "gastroplus-assessment-context",
  "simulationId": null,
  "backend": "external-import",
  "sourcePlatform": "GastroPlus",
  "assessmentBoundary": "pbpk-context-alignment-only",
  "decisionBoundary": "no-ngra-decision-policy",
  "validationDecision": null,
  "contextOfUse": {
    "regulatoryUse": {
      "requested": "research-only",
      "declared": null,
      "effective": "research-only"
    },
    "scientificPurpose": {
      "requested": "Tier 1 internal exposure screening",
      "declared": null,
      "effective": "Tier 1 internal exposure screening"
    },
    "decisionContext": {
      "requested": "BER handoff",
      "declared": null,
      "effective": "BER handoff"
    }
  },
  "domain": {
    "species": {
      "requested": "human",
      "declared": "human",
      "effective": "human"
    },
    "route": {
      "requested": "oral",
      "declared": "oral",
      "effective": "oral"
    },
    "lifeStage": {
      "requested": null,
      "declared": null,
      "effective": null
    },
    "population": {
      "requested": "adult",
      "declared": "adult",
      "effective": "adult"
    },
    "compound": {
      "requested": null,
      "declared": null,
      "effective": null
    }
  },
  "doseScenario": null,
  "targetOutput": {
    "requested": "Plasma|Parent|Concentration",
    "declared": [
      "Plasma|Parent|Concentration"
    ]
  },
  "workflowRole": {
    "role": "pbpk-exposure-translation-and-internal-dose-support",
    "workflow": "exposure-led-ngra",
    "upstreamDependencies": [
      "dose scenario or exposure estimate defined outside PBPK MCP",
      "in vitro ADME or IVIVE parameterization evidence defined outside PBPK MCP",
      "bioactivity, point-of-departure, or NAM interpretation defined outside PBPK MCP"
    ],
    "downstreamOutputs": [
      "internal exposure estimates",
      "PBPK qualification and uncertainty handoff objects",
      "BER-ready input bundle when compatible external PoD metadata are attached"
    ],
    "nonGoals": [
      "standalone weight-of-evidence integration",
      "standalone exposure assessment ownership",
      "direct regulatory decision authority",
      "standalone hazard or AOP interpretation"
    ]
  },
  "populationSupport": {
    "supportedSpecies": [
      "human"
    ],
    "supportedPhysiologyContexts": [],
    "supportedLifeStages": [],
    "supportedGenotypesOrPhenotypes": [],
    "variabilityRepresentation": "not-declared",
    "extrapolationPolicy": "outside-declared-population-context-requires-human-review"
  },
  "supports": {
    "declaredProfileComparison": true,
    "requestContextAlignment": true,
    "typedNgraHandoff": true,
    "decisionRecommendation": false
  }
}
